{
    "schema":  "orchconductor.library",
    "schemaVersion":  1,
    "libraryName":  "OrchConductor Factory Library",
    "libraryVersion":  "1.0.0",
    "pluginTarget":  "OrchConductor",
    "phase":  "3C-complete-factory-json",
    "notes":  [
                  "This file is a complete JSON expansion of the current hardcoded factory preset behavior.",
                  "OrchConductor does not parse this file at runtime in Phase 3C.",
                  "CC49 is reserved for Harp and should remain inactive.",
                  "Active player metadata is display-only and must not alter MIDI output."
              ],
    "midi":  {
                 "channel":  1,
                 "ccRange":  {
                                 "min":  20,
                                 "max":  54
                             },
                 "reservedControllers":  [
                                             {
                                                 "cc":  49,
                                                 "name":  "Harp",
                                                 "status":  "reserved",
                                                 "defaultValue":  0
                                             }
                                         ]
             },
    "instruments":  [
                        {
                            "id":  "woodwinds.piccolo",
                            "name":  "Piccolo",
                            "section":  "woodwinds",
                            "cc":  20,
                            "reserved":  false
                        },
                        {
                            "id":  "woodwinds.flute_1",
                            "name":  "Flute 1",
                            "section":  "woodwinds",
                            "cc":  21,
                            "reserved":  false
                        },
                        {
                            "id":  "woodwinds.flute_2",
                            "name":  "Flute 2",
                            "section":  "woodwinds",
                            "cc":  22,
                            "reserved":  false
                        },
                        {
                            "id":  "woodwinds.oboe_1",
                            "name":  "Oboe 1",
                            "section":  "woodwinds",
                            "cc":  23,
                            "reserved":  false
                        },
                        {
                            "id":  "woodwinds.oboe_2",
                            "name":  "Oboe 2",
                            "section":  "woodwinds",
                            "cc":  24,
                            "reserved":  false
                        },
                        {
                            "id":  "woodwinds.english_horn",
                            "name":  "English Horn",
                            "section":  "woodwinds",
                            "cc":  25,
                            "reserved":  false
                        },
                        {
                            "id":  "woodwinds.clarinet_1",
                            "name":  "Clarinet 1",
                            "section":  "woodwinds",
                            "cc":  26,
                            "reserved":  false
                        },
                        {
                            "id":  "woodwinds.clarinet_2",
                            "name":  "Clarinet 2",
                            "section":  "woodwinds",
                            "cc":  27,
                            "reserved":  false
                        },
                        {
                            "id":  "woodwinds.bass_clarinet",
                            "name":  "Bass Clarinet",
                            "section":  "woodwinds",
                            "cc":  28,
                            "reserved":  false
                        },
                        {
                            "id":  "woodwinds.bassoon_1",
                            "name":  "Bassoon 1",
                            "section":  "woodwinds",
                            "cc":  29,
                            "reserved":  false
                        },
                        {
                            "id":  "woodwinds.bassoon_2",
                            "name":  "Bassoon 2",
                            "section":  "woodwinds",
                            "cc":  30,
                            "reserved":  false
                        },
                        {
                            "id":  "woodwinds.contrabassoon",
                            "name":  "Contrabassoon",
                            "section":  "woodwinds",
                            "cc":  31,
                            "reserved":  false
                        },
                        {
                            "id":  "brass.horn_1",
                            "name":  "Horn 1",
                            "section":  "brass",
                            "cc":  32,
                            "reserved":  false
                        },
                        {
                            "id":  "brass.horn_2",
                            "name":  "Horn 2",
                            "section":  "brass",
                            "cc":  33,
                            "reserved":  false
                        },
                        {
                            "id":  "brass.horn_3",
                            "name":  "Horn 3",
                            "section":  "brass",
                            "cc":  34,
                            "reserved":  false
                        },
                        {
                            "id":  "brass.horn_4",
                            "name":  "Horn 4",
                            "section":  "brass",
                            "cc":  35,
                            "reserved":  false
                        },
                        {
                            "id":  "brass.trumpet_1",
                            "name":  "Trumpet 1",
                            "section":  "brass",
                            "cc":  36,
                            "reserved":  false
                        },
                        {
                            "id":  "brass.trumpet_2",
                            "name":  "Trumpet 2",
                            "section":  "brass",
                            "cc":  37,
                            "reserved":  false
                        },
                        {
                            "id":  "brass.trumpet_3",
                            "name":  "Trumpet 3",
                            "section":  "brass",
                            "cc":  38,
                            "reserved":  false
                        },
                        {
                            "id":  "brass.trombone_1",
                            "name":  "Trombone 1",
                            "section":  "brass",
                            "cc":  39,
                            "reserved":  false
                        },
                        {
                            "id":  "brass.trombone_2",
                            "name":  "Trombone 2",
                            "section":  "brass",
                            "cc":  40,
                            "reserved":  false
                        },
                        {
                            "id":  "brass.bass_trombone",
                            "name":  "Bass Trombone",
                            "section":  "brass",
                            "cc":  41,
                            "reserved":  false
                        },
                        {
                            "id":  "brass.tuba",
                            "name":  "Tuba",
                            "section":  "brass",
                            "cc":  42,
                            "reserved":  false
                        },
                        {
                            "id":  "percussion.timpani",
                            "name":  "Timpani",
                            "section":  "percussion",
                            "cc":  43,
                            "reserved":  false
                        },
                        {
                            "id":  "percussion.glockenspiel",
                            "name":  "Glockenspiel",
                            "section":  "percussion",
                            "cc":  44,
                            "reserved":  false
                        },
                        {
                            "id":  "percussion.xylophone",
                            "name":  "Xylophone",
                            "section":  "percussion",
                            "cc":  45,
                            "reserved":  false
                        },
                        {
                            "id":  "percussion.marimba",
                            "name":  "Marimba",
                            "section":  "percussion",
                            "cc":  46,
                            "reserved":  false
                        },
                        {
                            "id":  "percussion.vibraphone",
                            "name":  "Vibraphone",
                            "section":  "percussion",
                            "cc":  47,
                            "reserved":  false
                        },
                        {
                            "id":  "percussion.tubular_bells",
                            "name":  "Tubular Bells",
                            "section":  "percussion",
                            "cc":  48,
                            "reserved":  false
                        },
                        {
                            "id":  "reserved.harp",